{
  "$schema": "https://json-schema.org/draft/2020-12/schema",
  "$id": "https://github.com/konstruktor1/unifi-stubd/docs/schema/config.schema.json",
  "title": "unifi-stubd configuration",
  "type": "object",
  "additionalProperties": false,
  "properties": {
    "operation_mode": {
      "type": "string",
      "enum": ["stub", "bridge-observe", "observe", "port-map", "host-direct", "macvlan"]
    },
    "controller_url": {
      "type": "string"
    },
    "profile": {
      "type": "string"
    },
    "profile_file": {
      "type": "string"
    },
    "profile_dir": {
      "type": "string"
    },
    "mac": {
      "type": "string"
    },
    "ip": {
      "type": "string",
      "format": "ipv4"
    },
    "hostname": {
      "type": "string"
    },
    "model": {
      "type": "string"
    },
    "model_display": {
      "type": "string"
    },
    "ports": {
      "type": "integer",
      "minimum": 0
    },
    "link_speed": {
      "type": "integer",
      "minimum": 0
    },
    "uplink_speed": {
      "oneOf": [
        {
          "type": "string",
          "enum": ["auto", "profile"]
        },
        {
          "type": "integer",
          "minimum": 1
        }
      ]
    },
    "uplink_port": {
      "type": "integer",
      "minimum": 0
    },
    "uplink_neighbor": {
      "oneOf": [
        {
          "$ref": "#/$defs/neighbor"
        },
        {
          "type": "null"
        }
      ]
    },
    "port_neighbors": {
      "type": "array",
      "items": {
        "$ref": "#/$defs/port_neighbor"
      }
    },
    "port_overrides": {
      "type": "array",
      "items": {
        "$ref": "#/$defs/port_override"
      }
    },
    "bridge_observe": {
      "$ref": "#/$defs/bridge_observe"
    },
    "port_mappings": {
      "type": "array",
      "items": {
        "$ref": "#/$defs/port_mapping"
      }
    },
    "observe_interface": {
      "type": "string"
    },
    "observe_bridge": {
      "type": "string"
    },
    "lldp_source": {
      "type": "string",
      "enum": ["off", "lldpd"]
    },
    "traffic_source": {
      "type": "string",
      "enum": ["off"]
    },
    "log_source": {
      "type": "string",
      "enum": ["off", "journalctl", "syslog"]
    },
    "proc_source": {
      "type": "string",
      "enum": ["off", "procfs"]
    },
    "dbus_enabled": {
      "type": "boolean"
    },
    "dbus_bus": {
      "type": "string",
      "enum": ["system", "session"]
    },
    "syslog_path": {
      "type": "string"
    },
    "version": {
      "type": "string"
    },
    "interval_seconds": {
      "type": "integer",
      "minimum": 1
    },
    "no_discovery": {
      "type": "boolean"
    },
    "discovery_interface": {
      "type": "string"
    },
    "discovery_targets": {
      "type": "array",
      "items": {
        "type": "string"
      }
    },
    "management_lan": {
      "$ref": "#/$defs/management_lan"
    },
    "ssh_listen": {
      "type": "string"
    },
    "ssh_user": {
      "type": "string"
    },
    "ssh_password": {
      "type": "string"
    },
    "ssh_host_key_path": {
      "type": "string"
    },
    "state_path": {
      "type": "string"
    },
    "status_path": {
      "type": "string"
    }
  },
  "$defs": {
    "management_lan": {
      "type": "object",
      "additionalProperties": false,
      "properties": {
        "enabled": {
          "type": "boolean"
        },
        "vlan": {
          "type": "integer",
          "minimum": 0,
          "maximum": 4094
        },
        "network_name": {
          "type": "string"
        },
        "mode": {
          "type": "string",
          "enum": ["metadata-only", "preexisting-interface", "planned-host-vlan"]
        },
        "interface": {
          "type": "string"
        },
        "ip": {
          "type": "string",
          "format": "ipv4"
        },
        "controller_reachable": {
          "type": "string",
          "enum": ["off", "warn", "required"]
        },
        "adoption_strategy": {
          "type": "string",
          "enum": ["untagged-first", "tagged-only"]
        }
      }
    },
    "neighbor": {
      "type": "object",
      "additionalProperties": false,
      "properties": {
        "mac": {
          "type": "string"
        },
        "name": {
          "type": "string"
        },
        "hostname": {
          "type": "string"
        },
        "ip": {
          "type": "string",
          "format": "ipv4"
        },
        "vlan": {
          "type": "integer",
          "minimum": 0,
          "maximum": 4094
        },
        "static": {
          "type": "boolean"
        },
        "type": {
          "type": "string"
        },
        "age": {
          "type": "integer",
          "minimum": 0
        },
        "uptime": {
          "type": "integer",
          "minimum": 0
        }
      }
    },
    "port_neighbor": {
      "type": "object",
      "additionalProperties": false,
      "properties": {
        "port": {
          "type": "integer",
          "minimum": 1
        },
        "mac": {
          "type": "string"
        },
        "name": {
          "type": "string"
        },
        "hostname": {
          "type": "string"
        },
        "ip": {
          "type": "string",
          "format": "ipv4"
        },
        "vlan": {
          "type": "integer",
          "minimum": 0,
          "maximum": 4094
        },
        "static": {
          "type": "boolean"
        },
        "type": {
          "type": "string"
        },
        "age": {
          "type": "integer",
          "minimum": 0
        },
        "uptime": {
          "type": "integer",
          "minimum": 0
        }
      },
      "required": ["port"]
    },
    "port_override": {
      "type": "object",
      "additionalProperties": false,
      "properties": {
        "port": {
          "type": "integer",
          "minimum": 1
        },
        "name": {
          "type": "string"
        },
        "interface": {
          "type": "string"
        },
        "mac": {
          "type": "string"
        },
        "ip": {
          "type": "string"
        },
        "netmask": {
          "type": "string"
        },
        "role": {
          "type": "string",
          "enum": ["", "wan", "lan", "wan2", "lan2"]
        },
        "network_group": {
          "type": "string"
        },
        "speed": {
          "type": "integer",
          "minimum": 0
        },
        "media": {
          "type": "string"
        },
        "up": {
          "type": "boolean"
        }
      },
      "required": ["port"]
    },
    "bridge_observe": {
      "type": "object",
      "additionalProperties": false,
      "properties": {
        "bridge": {
          "type": "string"
        },
        "uplink_interface": {
          "type": "string"
        },
        "member_port_map": {
          "type": "array",
          "items": {
            "$ref": "#/$defs/bridge_member_port_map"
          }
        }
      }
    },
    "bridge_member_port_map": {
      "type": "object",
      "additionalProperties": false,
      "properties": {
        "member": {
          "type": "string"
        },
        "port": {
          "type": "integer",
          "minimum": 1
        }
      },
      "required": ["member", "port"]
    },
    "port_mapping": {
      "type": "object",
      "additionalProperties": false,
      "properties": {
        "port": {
          "type": "integer",
          "minimum": 1
        },
        "interface": {
          "type": "string"
        },
        "disabled": {
          "type": "boolean"
        },
        "unmapped": {
          "type": "boolean"
        }
      },
      "required": ["port"]
    }
  }
}
